[
    {
        "title": "QuixFolio",
        "start": "March 2023",
        "end": "April 2023",
        "description": "Developed a portfolio website template with a focus on modularity and ease of use.\nImplemented a dark mode toggle and a customizable theme switcher to personalize the website.\nDeployed the website on GitHub Pages and automated the deployment process with GitHub Actions.",
        "skills": [
            "ReactJS",
            "NextJS",
            "Material UI",
            "GitHub Pages",
            "GitHub Actions"
        ],
        "links": {
            "Website": "https://quixfolio.vercel.app/"
        },
        "image": "/images/quixfolio.webp",
        "collaborators": [
            {
                "name": "Parth Shah",
                "link": "https://helloparthshah.vercel.app/"
            },
            {
                "name": "Harshil Patel",
                "link": "https://www.harshilpatel.me/"
            }
        ]
    },
    {
        "title": "OLED Paint",
        "start": "May 2022",
        "end": "May 2022",
        "description": "Utilized SPI and I2C to create a tilt-based paint application between the CC3200 and Adafruit OLED.\nCreated a webserver and implemented a compression algorithm to transfer 128x128 bitmaps from a board to a computer 2x faster.\nConferred Best Lab Project for Spring 2022.\nSolidified skills of utilizing datasheet information to interact with hardware better.",
        "skills": [
            "C",
            "Python"
        ],
        "links": {
            "Blog Post": "/blogs/oledpaint"
        },
        "image": "/images/oledpaint.jpeg",
        "collaborators": [
            {
                "name": "Steven To",
                "link": "https://www.linkedin.com/in/to-steven/"
            }
        ]
    },
    {
        "title": "UNIfy - Course Assistant",
        "start": "January 2022",
        "end": "January 2022",
        "description": "Utilized the UC Davis Schedule Builder API to extract class timings and professors.\nFormulated a class-based hierarchized dictionary to maintain schedules of over 100 server members in five Discord servers.\nExtracted data from APIs of Rate My Professor and Google Calendar to add additional features to the bot.\nSolidified skills of good software design to understand and solve problem domain.",
        "skills": [
            "Discord Bot",
            "Python",
            "JavaScript"
        ],
        "image": "/images/unify.png",
        "links": {
            "Blog Post": "/blogs/unifycourseassistant"
        },
        "collaborators": [
            {
                "name": "Parth Shah",
                "link": "https://helloparthshah.vercel.app/"
            },
            {
                "name": "Harshil Patel",
                "link": "https://www.harshilpatel.me/"
            },
            {
                "name": "Keshav Agrawal",
                "link": "https://kasince2k.github.io/"
            }
        ]
    }
]